<?xml version="1.0" encoding="UTF-8"?>
<!DOCTYPE TEI SYSTEM "file:/D:/Git/georgian-mss/collections/MS_Georg_d_2.dtd">
<?xml-model href="http://www.tei-c.org/release/xml/tei/custom/schema/relaxng/tei_all.rng" type="application/xml" schematypens="http://relaxng.org/ns/structure/1.0"?>
<?xml-model href="http://www.tei-c.org/release/xml/tei/custom/schema/relaxng/tei_all.rng" type="application/xml" schematypens="http://purl.oclc.org/dsdl/schematron"?>
<?xml-stylesheet type="text/css" href="MS_Georg.css"?>

<TEI xmlns="http://www.tei-c.org/ns/1.0" xml:id="manuscript_55">
   <teiHeader>
      <fileDesc>
         <titleStmt>
            <title type="full">
               <title type="main">MS. Wardr. e. 1</title> 
               <title type="alt" xml:lang="en">Life of Saint Nisime</title>
               <title type="alt" xml:lang="ka">ცხოვრება წმიდისა ნისიმესი</title>
               <title type="alt" xml:lang="ka-la">cʻxovreba cmidisa nisimesi</title> 
            </title>
            <funder>JISC</funder>
            <principal>Gillian Evison</principal>
            <respStmt xml:id="IL">
               <persName>I. Lobzhanidze</persName>
               <resp>transcribed from original MS and converted to XML format</resp>
               <resp>markup and encoding</resp>
            </respStmt>
         </titleStmt>
         <editionStmt>
            <edition n="1">First publication edition, TEI P5.
               <date when="2019-02-21">21 February 2019</date>
            </edition>
            <funder>The project Wardrops' Collection Online is carried out within the framework of<ref target="http://rustaveli.org.ge/">Joint Research Programme of the University of Oxford and SRNSFG in Georgian Studies</ref></funder>
         </editionStmt>
         <publicationStmt>
            <publisher>Bodleian Library</publisher>
            <date calendar="#Gregorian">[Date when first made available]</date>
            <pubPlace>
               <address>
                  <addrLine>Department of Special Collections</addrLine>
                  <addrLine>Bodleian Library</addrLine>
                  <street>Broad Street</street>
                  <settlement>Oxford</settlement>
                  <postCode>OX1 3BG</postCode>
                  <addrLine>
                     <ref target="http://www.bodleian.ox.ac.uk/libraries/collections">Bodleian Library</ref>
                  </addrLine>
                  <addrLine>
                     <email>specialcollections.enquiries@bodleian.ox.ac.uk</email>
                  </addrLine>
               </address>
            </pubPlace>
            <distributor>
               <email>specialcollections.enquiries@bodleian.ox.ac.uk</email>
            </distributor>
            <idno type="msID">MS_Wardr_e_1</idno>
            <idno type="catalogue">Georgian</idno>
         </publicationStmt>
         <sourceDesc>
            <msDesc xml:id="MS_Wardr_e_1" xml:lang="en">
               <msIdentifier>
                  <country>United Kingdom</country>
                  <region type="county">Oxfordshire</region>
                  <settlement>Oxford</settlement>
                  <institution>Oxford University</institution>
                  <repository>Bodleian Library</repository>
                  <collection type="main">Oriental Manuscripts Wardrop Collection</collection>
                  <idno>MS. Wardr. e. 1</idno>
               </msIdentifier>
               <head>The life of Saint Nisime.</head>
               <msContents>
                  <summary>The life of Saint Nisime is well known for its different fragments in Syriac, Persian and Georgian languages. 
                     This manuscript belongs to XVIIIth century in accordance with watermark indicating "1784". This Manuscript consists of four parts with few additions and ornaments. 
                     The text is written in Mkhedruli script, while Asomtavruli script is used for titles, the first letters of paragraphs and sometimes for decoration. 
                  </summary>
                  <textLang mainLang="ka">Georgian</textLang>
                  <msItem xml:id="MS_Wardr_e_1-item1" n="1">
                     <locus from="2" to="222">pp. 2-22</locus>                     
                     <title xml:lang="en-Latn-x-lc" key="work_5">Life of St. Nisime</title>
                     <title xml:lang="ka" key="work_83">ცხოვრება წი<expan>&#x0360;<ex></ex></expan>სა ნისიმესი</title>
                     <incipit>              
                        <hi rend="color(FF0000)">Ⴋ</hi>აშინ თქუ̂ა მე წერილთა მრავალთა წარჳღე წიგნები<lb/>
                        სპარსეთით საბერძნეთად, დაკ<expan>&#x0360;<ex></ex></expan>დ წიგნები საბერძნეთით სპარ<lb/>
                        სეთად, და აღჳღი ქუ̂ჱლის საქმე ფ<expan>&#x0360;<ex></ex></expan>დ ალექსანდრიით, რ<expan>&#x0360;<ex></ex></expan> იყო ბერი ერთი<lb/>
                        შუ̂ჱნიერი, და კურთხეული და ყ<expan>&#x0360;<ex></ex></expan>ითურთ შემკობილი საქმითა ყოუ̂<lb/>
                        ლითა და იგი <damage><gap quantity="1" unit="chars" reason="illegible"/></damage> და ეკკლესიასა ალექსანდრიისასა:
                     </incipit>
                     <explicit>
                        რომლისა<lb/>
                        არს დიდება უ<lb/>
                        კუნითი უ<expan>&#x0360;<ex></ex></expan>კე<lb/>
                        რომლ’-<lb/>
                        ისა არს დიდე-<lb/>
                        ბა უკუნითი უკუ<lb/>
                        ნისამდე ამ<lb/>
                        ინ<lb/>
                       ..
                     </explicit>
                     <listBibl>
                        <bibl>CWC, 341</bibl>
                     </listBibl>                     
                     <textLang mainLang="ka">Georgian</textLang>
                  </msItem>
                  <msItem xml:id="MS_Wardr_e_1-item2" n="2">                     
                     <locus from="23" to="32">pp. 23-32</locus>   
                     <title xml:lang="ka-Latn-x-lc" key="work_6">cʻxovreba da mokʻalakʻeoba evpʻemianesi da żisa misisa alekʻsisa kacʻisa ġvtʻisa</title>
                     <title xml:lang="ka" key="work_6">ცხოვრება და მოქალაქეობა ევფემიანესი და ძისა მისისა ალექსისა კაცისა ღვთისა</title>
                     <incipit>              
                        ვინმე რომს ქალაქსა შ<expan>&#x0360;<ex></ex></expan>ა, კაცი მორწმუნე, და მართალი <lb/>
                        და მდიდარი ფ<expan>&#x0360;<ex></ex></expan>დ და სახელი მისი ავფემიანე, ამას ესხნეს მონანი...
                     </incipit>
                     <explicit>
                        უნთქუ̂ჱსვე აღმოჴდა სული სურნელებისა ადგილსა მისგან. ხ<expan>&#x0360;<ex></ex></expan> აღე-<lb/>
                        სრულა ნეტარი ესე, Ⴇთუ̂ჱსა მარტსა ათჩჳდმეტსა, და მიჳდა იგი<lb/>
                        წ<expan>&#x0360;<ex></ex></expan>ე ყ<expan>&#x0360;<ex></ex></expan>ისა, სადიდებელად მამისა და ძისა და წმიდისა სულისა ა<expan>&#x0360;<ex></ex></expan>წ და<lb/>
                        მარადის და უ<expan>&#x0360;<ex></ex></expan>კი უ<expan>&#x0360;<ex></ex></expan>ვე ამინ : Ⴋეოც მეყავ წ<expan>&#x0360;<ex></ex></expan>ო ღ<expan>&#x0360;<ex></ex></expan>ისბო, ცრლ<lb/>
                        ჳლს ზირაქს :
                     </explicit>
                     <listBibl>
                        <bibl>CWC, 341</bibl>
                     </listBibl>
                     <textLang mainLang="ka">Georgian</textLang>
                  </msItem>
                  <msItem xml:id="MS_Wardr_e_1-item3" n="3">
                     <locus from="32" to="32">pp. 32</locus>                      
                     <title xml:lang="en-Latn-x-lc" key="work_8">Acrostic on the name Aleksi, followed by a prayer for the scribe Zirak'i</title>
                     <title xml:lang="ka" key="work_6">ცხოვრება და მოქალაქეობა ევფემიანესი და ძისა მისისა ალექსისა კაცისა ღვთისა</title>
                     <listBibl>
                        <bibl>CWC, 341</bibl>
                     </listBibl>
                     <textLang mainLang="ka">Georgian</textLang>
                  </msItem>
                  <msItem xml:id="MS_Wardr_e_1-item4" n="4">
                     <locus from="1" to="8">pp. 1-8</locus> 
                     <title xml:lang="ka-Latn-x-lc" key="work_9">galoba moc'ik'ulisa</title>
                     <title xml:lang="ka" key="work_9">გალობა მოციქულისა</title>
                     <incipit>
                        <hi rend="color(FF0000)">Ⴑ</hi>ასუფეველი ცათა ღირსო რ<expan>&#x0360;<ex></ex></expan>ლიცაჲ და იმკჳდრე.<lb/>
                        და მზრახუ̂ჱლ ზეციერ. იქმენ შენ სიტყუ̂ასა;, მრწ-<lb/>
                        მუნებელნი ღ<expan>&#x0360;<ex></ex></expan>ის-მეტყუ̂ჱლებათა’ შენთა’, და ქადაგების-<lb/>
                        ანი’, და იფარენ ვედრებითა შენითა:
                     </incipit>
                     <explicit> 
                        Ⴑ<expan>&#x0360;<ex></ex></expan>ნსა შემცუ̂ჱლსა, სად ნა <damage><gap quantity="1" unit="chars" reason="illegible"/></damage><lb/>
                        Ⴞარდაქცეულებ, რტო დაცჳენ <damage><gap quantity="1" unit="chars" reason="illegible"/></damage><lb/>
                        Ⴈანი შენნი, ა’ღარ ჰფშვან სუნელთა,<lb/>
                        Ⴃავბილთა ფერი, ბაგითურთ <gap reason="illegible" quantity="1" unit="letter"/>გხდომ<gap reason="illegible" quantity="2" unit="letter"/> <damage><gap quantity="1" unit="chars" reason="illegible"/></damage>
                     </explicit>                     
                     <listBibl>
                        <bibl>CWC, 341</bibl>
                     </listBibl>
                     <textLang mainLang="ka">Georgian</textLang>
                  </msItem>
               </msContents>
               <physDesc>
                  <objectDesc form="leaf">
                     <supportDesc material="paper">
                        <support>The Manuscript is written on paper. The first and the last page is damaged</support>
                        <extent>